<?xml version="1.0" encoding="UTF-8" ?>

<!DOCTYPE HechosHistoricos SYSTEM "HechosHistoricos.dtd">
<HechosHistoricos>
    <HechoHistorico descripcion="">
        <Fecha>
            <FormatoFecha>
            <Dia>01</Dia>
            <Mes>01</Mes>
            <AÃ±o>2022</AÃ±o>
            </FormatoFecha>
        </Fecha>
        <Epoca>
            <EPOCA1></EPOCA1>
        </Epoca>
        <PersonajeDestacado>
            Test persona <Nombre></Nombre> y fecha de nacimiento: <FechaNacimiento></FechaNacimiento>
        </PersonajeDestacado>
        <FechaRelevante/>
    </HechoHistorico>
    <HechoHistorico descripcion="">
        <Fecha>
            2022-10-09
        </Fecha>
        <Epoca>
            <EPOCA2></EPOCA2>
        </Epoca>
        <PersonajeDestacado></PersonajeDestacado>
        <PersonajeDestacado></PersonajeDestacado>
        <FechaRelevante/>
    </HechoHistorico>
</HechosHistoricos>